{
  "schemaVersion": 2,
  "catalogVersion": "0.1.0",
  "providers": [
    {
      "id": "openai",
      "name": "OpenAI",
      "mark": "OpenAI"
    },
    {
      "id": "anthropic",
      "name": "Anthropic",
      "mark": "AI"
    },
    {
      "id": "google",
      "name": "Google",
      "mark": "G"
    },
    {
      "id": "meta",
      "name": "Meta",
      "mark": "M"
    },
    {
      "id": "xai",
      "name": "xAI",
      "mark": "xAI"
    },
    {
      "id": "deepseek",
      "name": "DeepSeek",
      "mark": "DS"
    },
    {
      "id": "mistral",
      "name": "Mistral AI",
      "mark": "M"
    },
    {
      "id": "cohere",
      "name": "Cohere",
      "mark": "C"
    },
    {
      "id": "alibaba",
      "name": "Alibaba Qwen",
      "mark": "Q"
    },
    {
      "id": "microsoft",
      "name": "Microsoft",
      "mark": "MS"
    },
    {
      "id": "moonshot",
      "name": "Moonshot AI",
      "mark": "K"
    },
    {
      "id": "zai",
      "name": "Z.ai",
      "mark": "GLM"
    },
    {
      "id": "ibm",
      "name": "IBM",
      "mark": "IBM"
    },
    {
      "id": "nvidia",
      "name": "NVIDIA",
      "mark": "NV"
    }
  ],
  "tokenizers": [
    {
      "id": "openai-o200k",
      "kind": "core",
      "provider": "openai",
      "encoding": "o200k_base",
      "label": "OpenAI o200k",
      "accent": "coral"
    },
    {
      "id": "openai-cl100k",
      "kind": "core",
      "provider": "openai",
      "encoding": "cl100k_base",
      "label": "OpenAI cl100k",
      "accent": "blue"
    },
    {
      "id": "deepseek-v3.2",
      "kind": "open",
      "provider": "deepseek",
      "encoding": "deepseek-ai/DeepSeek-V3.2",
      "label": "DeepSeek V3.2",
      "accent": "coral",
      "repository": "deepseek-ai/DeepSeek-V3.2",
      "revision": "a7e62ac04ecb2c0a54d736dc46601c5606cf10a6",
      "sourceUrl": "https://huggingface.co/deepseek-ai/DeepSeek-V3.2/tree/a7e62ac04ecb2c0a54d736dc46601c5606cf10a6",
      "decoder": "byte_level",
      "supportsBoundaries": true
    },
    {
      "id": "google-gemini-3-pro-preview",
      "kind": "open",
      "provider": "google",
      "encoding": "Google LocalTokenizer \u00b7 gemma3",
      "label": "Google Gemini local",
      "accent": "blue",
      "repository": "google/gemma_pytorch",
      "revision": "014acb7ac4563a5f77c76d7ff98f31b568c16508",
      "artifactUrl": "https://raw.githubusercontent.com/google/gemma_pytorch/014acb7ac4563a5f77c76d7ff98f31b568c16508/tokenizer/gemma3_cleaned_262144_v2.spiece.model",
      "artifactSha256": "1299c11d7cf632ef3b4e11937501358ada021bbdf7c47638d13c0ee982f2e79c",
      "artifactSizeBytes": 4627838,
      "sourceUrl": "https://github.com/googleapis/js-genai/blob/v2.30.0/src/cross/tokenizer/_loader.ts",
      "decoder": "native_sentencepiece",
      "supportsBoundaries": true
    },
    {
      "id": "meta-llama-4",
      "kind": "open",
      "provider": "meta",
      "encoding": "llama4/tokenizer.model",
      "label": "Meta Llama 4",
      "accent": "blue",
      "repository": "meta-llama/llama-models",
      "revision": "0e0b8c519242d5833d8c11bffc1232b77ad7f301",
      "artifactUrl": "https://raw.githubusercontent.com/meta-llama/llama-models/0e0b8c519242d5833d8c11bffc1232b77ad7f301/models/llama4/tokenizer.model",
      "artifactSha256": "d0bdbaf59b0762c8c807617e2d8ea51420eb1b1de266df2495be755c8e0ed6ed",
      "sourceUrl": "https://github.com/meta-llama/llama-models/blob/0e0b8c519242d5833d8c11bffc1232b77ad7f301/models/llama4/tokenizer.model",
      "decoder": "tiktoken",
      "pattern": "[^\\r\\n\\p{L}\\p{N}]?[\\p{Lu}\\p{Lt}\\p{Lm}\\p{Lo}\\p{M}]*[\\p{Ll}\\p{Lm}\\p{Lo}\\p{M}]+('s|'S|'t|'T|'re|'rE|'Re|'RE|'ve|'vE|'Ve|'VE|'m|'M|'ll|'lL|'Ll|'LL|'d|'D)?|[^\\r\\n\\p{L}\\p{N}]?[\\p{Lu}\\p{Lt}\\p{Lm}\\p{Lo}\\p{M}]+[\\p{Ll}\\p{Lm}\\p{Lo}\\p{M}]*('s|'S|'t|'T|'re|'rE|'Re|'RE|'ve|'vE|'Ve|'VE|'m|'M|'ll|'lL|'Ll|'LL|'d|'D)?|\\p{N}{1,3}| ?[^\\s\\p{L}\\p{N}]+[\\r\\n/]*|\\s*[\\r\\n]+|\\s+(?!\\S)|\\s+",
      "supportsBoundaries": true
    },
    {
      "id": "mistral-7b-v0.3",
      "kind": "open",
      "provider": "mistral",
      "encoding": "mistralai/Mistral-7B-Instruct-v0.3",
      "label": "Mistral 7B v0.3",
      "accent": "coral",
      "repository": "mistralai/Mistral-7B-Instruct-v0.3",
      "revision": "c170c708c41dac9275d15a8fff4eca08d52bab71",
      "sourceUrl": "https://huggingface.co/mistralai/Mistral-7B-Instruct-v0.3/tree/c170c708c41dac9275d15a8fff4eca08d52bab71",
      "decoder": "sentencepiece",
      "supportsBoundaries": true
    },
    {
      "id": "cohere-command-a-plus",
      "kind": "open",
      "provider": "cohere",
      "encoding": "CohereLabs/command-a-plus-05-2026-w4a4",
      "label": "Cohere Command A+",
      "accent": "blue",
      "repository": "CohereLabs/command-a-plus-05-2026-w4a4",
      "revision": "ebd2d72c0f9a84389c6b057136d38c435aea2700",
      "sourceUrl": "https://huggingface.co/CohereLabs/command-a-plus-05-2026-w4a4/tree/ebd2d72c0f9a84389c6b057136d38c435aea2700",
      "decoder": "byte_level",
      "supportsBoundaries": true
    },
    {
      "id": "xai-grok-1",
      "kind": "open",
      "provider": "xai",
      "encoding": "xai-org/grok-1/tokenizer.model",
      "label": "xAI Grok-1",
      "accent": "coral",
      "repository": "xai-org/grok-1",
      "revision": "7050ed204b8206bb8645c7b7bbef7252f79561b0",
      "artifactUrl": "https://raw.githubusercontent.com/xai-org/grok-1/7050ed204b8206bb8645c7b7bbef7252f79561b0/tokenizer.model",
      "artifactSha256": "5c69d7cbad192fa2c9d14e2a77fbfdc11597c68907b043ddb0260e3d28eddd7f",
      "sourceUrl": "https://github.com/xai-org/grok-1/blob/7050ed204b8206bb8645c7b7bbef7252f79561b0/tokenizer.model",
      "decoder": "native_sentencepiece",
      "supportsBoundaries": true
    },
    {
      "id": "alibaba-qwen3-8b",
      "kind": "open",
      "provider": "alibaba",
      "encoding": "Qwen/Qwen3-8B",
      "label": "Alibaba Qwen 3",
      "accent": "blue",
      "repository": "Qwen/Qwen3-8B",
      "revision": "b968826d9c46dd6066d109eabc6255188de91218",
      "sourceUrl": "https://huggingface.co/Qwen/Qwen3-8B/tree/b968826d9c46dd6066d109eabc6255188de91218",
      "artifactSizeBytes": 11422654,
      "decoder": "byte_level",
      "supportsBoundaries": true,
      "boundaryLimitation": "The tokenizer normalizes its input to NFC before encoding. Input already in NFC keeps exact raw-input byte spans; other input is encoded in its normalized form, and the breakdown describes those normalized bytes.",
      "normalization": "NFC"
    },
    {
      "id": "microsoft-phi-4",
      "kind": "open",
      "provider": "microsoft",
      "encoding": "microsoft/phi-4",
      "label": "Microsoft Phi-4",
      "accent": "coral",
      "repository": "microsoft/phi-4",
      "revision": "2db69c1c3e91a05d2c64a3185acfbaf36f744e25",
      "sourceUrl": "https://huggingface.co/microsoft/phi-4/tree/2db69c1c3e91a05d2c64a3185acfbaf36f744e25",
      "artifactSizeBytes": 4253055,
      "decoder": "byte_level",
      "supportsBoundaries": true
    },
    {
      "id": "moonshot-kimi-k2-instruct",
      "kind": "open",
      "provider": "moonshot",
      "encoding": "moonshotai/Kimi-K2-Instruct",
      "label": "Moonshot Kimi K2",
      "accent": "blue",
      "repository": "moonshotai/Kimi-K2-Instruct",
      "revision": "fd1984e2b7a3350dbf7305fe73a4ede25c14de50",
      "artifactUrl": "https://huggingface.co/moonshotai/Kimi-K2-Instruct/resolve/fd1984e2b7a3350dbf7305fe73a4ede25c14de50/tiktoken.model",
      "artifactSha256": "b6c497a7469b33ced9c38afb1ad6e47f03f5e5dc05f15930799210ec050c5103",
      "artifactSizeBytes": 2795286,
      "sourceUrl": "https://huggingface.co/moonshotai/Kimi-K2-Instruct/tree/fd1984e2b7a3350dbf7305fe73a4ede25c14de50",
      "decoder": "tiktoken",
      "pattern": "\\p{Script_Extensions=Han}+|[^\\r\\n\\p{L}\\p{N}]?(?:(?!\\p{Script_Extensions=Han})[\\p{Lu}\\p{Lt}\\p{Lm}\\p{Lo}\\p{M}])*(?:(?!\\p{Script_Extensions=Han})[\\p{Ll}\\p{Lm}\\p{Lo}\\p{M}])+(?:'s|'S|'t|'T|'re|'rE|'Re|'RE|'ve|'vE|'Ve|'VE|'m|'M|'ll|'lL|'Ll|'LL|'d|'D)?|[^\\r\\n\\p{L}\\p{N}]?(?:(?!\\p{Script_Extensions=Han})[\\p{Lu}\\p{Lt}\\p{Lm}\\p{Lo}\\p{M}])+(?:(?!\\p{Script_Extensions=Han})[\\p{Ll}\\p{Lm}\\p{Lo}\\p{M}])*(?:'s|'S|'t|'T|'re|'rE|'Re|'RE|'ve|'vE|'Ve|'VE|'m|'M|'ll|'lL|'Ll|'LL|'d|'D)?|\\p{N}{1,3}| ?[^\\s\\p{L}\\p{N}]+[\\r\\n]*|\\s*[\\r\\n]+|\\s+(?!\\S)|\\s+",
      "supportsBoundaries": true
    },
    {
      "id": "zai-glm-4.5",
      "kind": "open",
      "provider": "zai",
      "encoding": "zai-org/GLM-4.5",
      "label": "Z.ai GLM 4.5",
      "accent": "coral",
      "repository": "zai-org/GLM-4.5",
      "revision": "cbb2c7cfb52fa128a9660cb1a7a78e017899e115",
      "sourceUrl": "https://huggingface.co/zai-org/GLM-4.5/tree/cbb2c7cfb52fa128a9660cb1a7a78e017899e115",
      "artifactSizeBytes": 19970699,
      "decoder": "byte_level",
      "supportsBoundaries": true
    },
    {
      "id": "ibm-granite-3.3-8b-instruct",
      "kind": "open",
      "provider": "ibm",
      "encoding": "ibm-granite/granite-3.3-8b-instruct",
      "label": "IBM Granite 3.3",
      "accent": "blue",
      "repository": "ibm-granite/granite-3.3-8b-instruct",
      "revision": "51dd4bc2ade4059a6bd87649d68aa11e4fb2529b",
      "sourceUrl": "https://huggingface.co/ibm-granite/granite-3.3-8b-instruct/tree/51dd4bc2ade4059a6bd87649d68aa11e4fb2529b",
      "artifactSizeBytes": 3476578,
      "decoder": "byte_level",
      "supportsBoundaries": true
    },
    {
      "id": "nvidia-opencode-reasoning-nemotron-7b",
      "kind": "open",
      "provider": "nvidia",
      "encoding": "nvidia/OpenCodeReasoning-Nemotron-7B",
      "label": "NVIDIA Nemotron",
      "accent": "coral",
      "repository": "nvidia/OpenCodeReasoning-Nemotron-7B",
      "revision": "3baa2a3d73bbca12483ad19fef7babdcb2222987",
      "sourceUrl": "https://huggingface.co/nvidia/OpenCodeReasoning-Nemotron-7B/tree/3baa2a3d73bbca12483ad19fef7babdcb2222987",
      "artifactSizeBytes": 11421896,